{
  "schema_version": "1.0",
  "language": "en",
  "title": "Evidence-grounded review: Feedback-Guided Retrieval (fictional fixture)",
  "review_confidence": "MEDIUM",
  "executive_assessment": [
    {
      "text": "The manuscript evaluates usage feedback in a controlled memory simulator with twelve generated scenarios and paired ranking configurations. It reports a large D-versus-C difference in known-query retrieval, alongside a sham diagnostic whose scenario-level interval does not establish a practically relevant gain. These are measurements of a specified synthetic mechanism, and no natural-language interaction or pretrained embedding model is evaluated.",
      "information_type": "manuscript_fact",
      "evidence_ids": [
        "E4",
        "E5",
        "E6",
        "E16",
        "E18"
      ],
      "external_source_ids": [],
      "reasoning": ""
    },
    {
      "text": "The strongest contribution is the interpretable feedback-only comparison, complemented by a pre-specified negative diagnostic and explicit disclosure of external-validity and bootstrap limitations. The negative result contributes useful information about measurement stability; its direction does not reduce the quality of that diagnostic design.",
      "information_type": "reviewer_inference",
      "evidence_ids": [
        "E6",
        "E9",
        "E12",
        "E18",
        "E21",
        "E22"
      ],
      "external_source_ids": [],
      "reasoning": "Interpretation is confined to the cited manuscript passages."
    },
    {
      "text": "The biggest uncertainty is how much of the apparent precision survives scenario-level resampling and how the synthetic effect transfers beyond this generator. The first conclusion sentence claims real-world assistant improvements despite the explicit generalization boundary. An abstract/table discrepancy additionally prevents confirmation of the intended aggregate accuracy. Review confidence is medium because the design and reporting issues are directly grounded, while raw results and executable artifacts are unavailable for independent reproduction.",
      "information_type": "reviewer_inference",
      "evidence_ids": [
        "E1",
        "E11",
        "E15",
        "E21",
        "E23",
        "E24"
      ],
      "external_source_ids": [],
      "reasoning": "Interpretation is confined to the cited manuscript passages."
    }
  ],
  "strengths": [
    {
      "strength_id": "S1",
      "text": "C/D isolates the feedback term within paired generated scenarios.",
      "evidence_ids": [
        "E6",
        "E7"
      ],
      "why_it_matters": "This directly targets the simulator-level contribution with an interpretable control, within the specified mechanism.",
      "confidence": "HIGH",
      "information_type": "reviewer_inference"
    },
    {
      "strength_id": "S2",
      "text": "The pre-specified sham diagnostic reports its uncertain negative result with paired scenario-level resampling.",
      "evidence_ids": [
        "E9",
        "E12",
        "E18"
      ],
      "why_it_matters": "A negative diagnostic can reveal measurement artifacts; the paper avoids claiming equivalence from an interval spanning zero.",
      "confidence": "HIGH",
      "information_type": "reviewer_inference"
    },
    {
      "strength_id": "S3",
      "text": "The manuscript explicitly discloses external-validity and resampling-unit limitations.",
      "evidence_ids": [
        "E21",
        "E22"
      ],
      "why_it_matters": "Transparency makes the evidential boundary inspectable, even though the conclusion needs alignment.",
      "confidence": "HIGH",
      "information_type": "manuscript_fact"
    }
  ],
  "concerns": [
    {
      "concern_id": "M1",
      "severity": "major",
      "category": "claim",
      "title": "Conclusion exceeds the simulator evidence",
      "claim": "The broad assistant-improvement statement is not established by this synthetic retrieval experiment.",
      "evidence_ids": [
        "E5",
        "E6",
        "E7",
        "E19",
        "E21",
        "E24"
      ],
      "reasoning": "The conclusion's first sentence claims real-world transfer while the limitations explicitly rule out such generalization. The later qualification does not resolve the unconditional sentence. Authors explicitly acknowledge the external-validity boundary; the concern is the conflicting conclusion.",
      "impact": "Readers may attribute end-to-end deployment benefits to a study that measures generated known-query retrieval only.",
      "suggested_fix": "Limit the first conclusion sentence to SimMem-v1, or provide evidence testing the broader claim.",
      "confidence": "HIGH",
      "information_type": "reviewer_inference",
      "root_cause": "unsupported_transfer",
      "affected_scope": "C3",
      "claim_ids": [
        "C3"
      ],
      "origin_ids": [
        "CL01",
        "MD01"
      ],
      "priority": 1
    },
    {
      "concern_id": "M2",
      "severity": "major",
      "category": "statistical",
      "title": "Query bootstrap does not preserve scenario dependence",
      "claim": "The reported D-minus-C interval does not establish uncertainty across independent generated scenarios.",
      "evidence_ids": [
        "E4",
        "E11",
        "E22"
      ],
      "reasoning": "Queries share state within twelve scenarios but are resampled as 12,000 independent outcomes. The authors disclose possible underestimation; the actual amount cannot be calculated without scenario-level data.",
      "impact": "The effect magnitude is documented, but precision and inference beyond these scenarios remain uncertain.",
      "suggested_fix": "Report paired scenario-level contrasts and an interval that preserves the independent scenario units.",
      "confidence": "HIGH",
      "information_type": "reviewer_inference",
      "root_cause": "bootstrap_unit",
      "affected_scope": "C1_interval",
      "claim_ids": [
        "C1"
      ],
      "origin_ids": [
        "ST01"
      ],
      "priority": 2
    },
    {
      "concern_id": "M3",
      "severity": "moderate",
      "category": "internal_consistency",
      "title": "Abstract and table report different aggregate accuracy",
      "claim": "D accuracy is 96.2% in the abstract and 95.2% in Table 1 for the same SimMem-v1 aggregate quantity.",
      "evidence_ids": [
        "E1",
        "E10",
        "E15"
      ],
      "reasoning": "Reviewer-confirmed metric/dataset/model/split/aggregation identities match, and the 1.0 percentage point difference exceeds rounding. The correct value cannot be adjudicated from these passages alone.",
      "impact": "The discrepancy changes the reported gain if the abstract value is used. Table-based arithmetic is internally consistent.",
      "suggested_fix": "Reconcile the source of the abstract number with Table 1 and update the affected summary.",
      "confidence": "HIGH",
      "information_type": "reviewer_inference",
      "root_cause": "accuracy_mismatch",
      "affected_scope": "D_aggregate",
      "claim_ids": [
        "C1"
      ],
      "origin_ids": [
        "IN01"
      ],
      "priority": 2
    },
    {
      "concern_id": "M4",
      "severity": "moderate",
      "category": "reproducibility",
      "title": "Core simulation artifacts are not supplied",
      "claim": "Exact seeds, code, per-scenario measurements and analysis scripts are not established in this supplied draft.",
      "evidence_ids": [
        "E13",
        "E23"
      ],
      "reasoning": "The draft describes generator parameters and software versions but explicitly omits execution and analysis artifacts. This does not establish that the authors used only one seed or lacked these artifacts internally.",
      "impact": "Independent reruns and corrected scenario-level intervals cannot be checked from the supplied material.",
      "suggested_fix": "Provide a versioned generator, seed schedule, raw scenario-level results and analysis scripts.",
      "confidence": "HIGH",
      "information_type": "reviewer_inference",
      "root_cause": "simulation_artifacts",
      "affected_scope": "main_results",
      "claim_ids": [
        "C1",
        "C2"
      ],
      "origin_ids": [
        "RP01"
      ],
      "priority": 3
    }
  ],
  "module_findings": {
    "methodology": [
      {
        "concern_id": "MD01",
        "severity": "major",
        "category": "methodology",
        "title": "External-validity boundary is explicitly disclosed",
        "claim": "The synthetic-vector and manually specified feedback design supports a controlled mechanism, with limited deployment scope.",
        "evidence_ids": [
          "E5",
          "E6",
          "E7",
          "E19",
          "E21"
        ],
        "reasoning": "The C/D contrast isolates the feedback factor, but no natural-language task or learned feedback mechanism is tested. Authors already disclose this boundary; this is not a failure to recognize limitations.",
        "impact": "This boundary matters for the broad C3 conclusion, not for invalidating all controlled results.",
        "suggested_fix": "Align the conclusion with the stated scope; real-embedding tests would be an optional route to broader support.",
        "confidence": "HIGH",
        "information_type": "reviewer_inference",
        "root_cause": "unsupported_transfer",
        "affected_scope": "C3",
        "claim_ids": [
          "C3"
        ],
        "origin_ids": [],
        "priority": 1
      }
    ],
    "statistical": [
      {
        "concern_id": "ST01",
        "severity": "major",
        "category": "statistical",
        "title": "Query bootstrap does not preserve scenario dependence",
        "claim": "The reported D-minus-C interval does not establish uncertainty across independent generated scenarios.",
        "evidence_ids": [
          "E4",
          "E11",
          "E22"
        ],